{
  "$schema": "http://json-schema.org/draft-07/schema#",
  "$id": "https://workflowhub.local/runtime/schemas/stage-reflection.v1.json",
  "title": "WorkflowHub stage reflection judgment",
  "type": "object",
  "additionalProperties": false,
  "required": [
    "schema_version",
    "record_kind",
    "task_id",
    "stage",
    "stage_status",
    "generated_at",
    "status",
    "error",
    "judgments",
    "interventions",
    "lessons_added"
  ],
  "properties": {
    "schema_version": { "const": "stage-reflection.v1" },
    "record_kind": { "const": "judgment" },
    "task_id": { "type": "string", "minLength": 1 },
    "stage": { "enum": ["make-decision", "build-spec", "build-plan", "build-code", "verify-code"] },
    "stage_status": { "enum": ["completed", "failed"] },
    "generated_at": { "type": "string", "format": "date-time" },
    "status": { "enum": ["ok", "degraded", "failed", "unavailable", "not_scheduled"] },
    "identity": { "$ref": "#/$defs/identity" },
    "source": { "$ref": "#/$defs/source" },
    "error": {
      "anyOf": [
        { "type": "null" },
        {
          "type": "object",
          "additionalProperties": false,
          "required": ["summary"],
          "properties": { "summary": { "type": "string", "minLength": 1 } }
        }
      ]
    },
    "judgments": { "type": "array", "items": { "$ref": "#/$defs/judgment" } },
    "interventions": { "type": "array", "items": { "$ref": "#/$defs/intervention" } },
    "lessons_added": { "type": "array", "items": { "anyOf": [{ "$ref": "#/$defs/safe_ref" }, { "$ref": "#/$defs/lesson_ref" }] } },
    "availability_fact": { "$ref": "#/$defs/availability_fact" }
  },
  "allOf": [
    {
      "if": { "properties": { "status": { "const": "failed" } }, "required": ["status"] },
      "then": { "properties": { "error": { "type": "object" } } }
    },
    {
      "if": { "properties": { "status": { "enum": ["ok", "degraded"] } }, "required": ["status"] },
      "then": { "properties": { "error": { "type": "null" } } }
    },
    {
      "if": { "properties": { "status": { "enum": ["unavailable", "not_scheduled"] } }, "required": ["status"] },
      "then": {
        "properties": {
          "error": { "type": "null" },
          "judgments": { "maxItems": 0 },
          "interventions": { "maxItems": 0 },
          "lessons_added": { "maxItems": 0 }
        }
      }
    }
  ],
  "$defs": {
    "identity": {
      "type": "object",
      "additionalProperties": false,
      "required": ["task_id", "worktree", "branch", "attempt", "snapshot_tree", "material_revision"],
      "properties": {
        "task_id": { "type": "string", "minLength": 1 },
        "worktree": { "type": ["string", "null"], "minLength": 1 },
        "branch": { "type": ["string", "null"], "minLength": 1 },
        "attempt": { "type": ["string", "null"], "minLength": 1 },
        "snapshot_tree": { "type": ["string", "null"], "pattern": "^[a-f0-9]{40,64}$" },
        "material_revision": { "type": ["string", "null"], "pattern": "^revision-[a-f0-9]{64}$" }
      }
    },
    "source": {
      "type": "object",
      "additionalProperties": false,
      "required": ["ref", "sha256"],
      "properties": {
        "ref": { "type": "string", "pattern": "^quality/evidence/stage-outcomes/(?:make-decision|build-spec|build-plan|build-code|verify-code)/[a-f0-9]{64}\\.json$" },
        "sha256": { "type": "string", "pattern": "^[a-f0-9]{64}$" }
      }
    },
    "safe_ref": {
      "type": "string",
      "minLength": 1,
      "pattern": "^(?!.*\\.\\.)quality/(?:evidence|tests|reviews|confirmations|stage-reflection)/[^\\s]+$"
    },
    "lesson_ref": {
      "type": "string",
      "minLength": 1,
      "pattern": "^lessons/(?:make-decision|build-spec|build-plan|build-code|verify-code)\\.jsonl#[A-Za-z0-9][A-Za-z0-9._-]*$"
    },
    "availability_fact": {
      "type": "object",
      "additionalProperties": false,
      "required": ["stage", "state", "reason_code", "observed_at", "task_identity"],
      "properties": {
        "stage": { "enum": ["make-decision", "build-spec", "build-plan", "build-code", "verify-code"] },
        "state": { "enum": ["unavailable", "not_scheduled"] },
        "reason_code": { "enum": ["executor_absent", "preflight_failed", "identity_failed", "startup_failed", "interrupted", "not_started"] },
        "observed_at": { "type": "string", "format": "date-time" },
        "task_identity": {
          "type": "object",
          "additionalProperties": false,
          "required": ["task_id", "worktree", "branch"],
          "properties": {
            "task_id": { "type": "string", "minLength": 1 },
            "worktree": { "type": "string", "minLength": 1 },
            "branch": { "type": "string", "minLength": 1 },
            "attempt": { "type": ["string", "null"] },
            "snapshot_tree": { "type": ["string", "null"] },
            "material_revision": { "type": ["string", "null"] }
          }
        }
      }
    },
    "judgment": {
      "type": "object",
      "additionalProperties": false,
      "required": [
        "subject_id",
        "subject_kind",
        "classification",
        "severity",
        "reason",
        "evidence_refs",
        "confidence",
        "next_review_trigger"
      ],
      "properties": {
        "subject_id": { "type": "string", "minLength": 1 },
        "subject_kind": { "enum": ["step", "skill"] },
        "classification": { "enum": ["keep", "optimize", "simplify", "merge", "remove_candidate", "add", "needs_evidence"] },
        "severity": { "enum": ["high", "medium", "low"] },
        "reason": { "type": "string", "minLength": 1 },
        "evidence_refs": { "type": "array", "items": { "$ref": "#/$defs/safe_ref" } },
        "confidence": { "enum": ["high", "medium", "low"] },
        "next_review_trigger": { "type": "string", "minLength": 1 }
      },
      "allOf": [
        {
          "if": { "properties": { "confidence": { "const": "high" } }, "required": ["confidence"] },
          "then": { "properties": { "evidence_refs": { "minItems": 1 } } }
        }
      ]
    },
    "intervention": {
      "type": "object",
      "additionalProperties": false,
      "required": ["confirmation_ref", "step_slug", "reply_text", "attribution", "confidence"],
      "properties": {
        "confirmation_ref": {
          "type": "string",
          "pattern": "^(?!.*\\.\\.)quality/confirmations/[a-f0-9]{64}\\.json$"
        },
        "step_slug": { "type": "string", "minLength": 1 },
        "reply_text": { "type": ["string", "null"], "minLength": 1 },
        "attribution": { "type": "string", "minLength": 1 },
        "confidence": { "enum": ["high", "medium", "low"] }
      },
      "allOf": [
        {
          "if": { "properties": { "reply_text": { "type": "null" } }, "required": ["reply_text"] },
          "then": { "properties": { "confidence": { "enum": ["medium", "low"] } } }
        }
      ]
    }
  }
}
